index,address,region_dist_code,region_repdistnum,region_rep_dist,region_rep_first,region_rep_last,region_rep_party,region_rep,region_url,in_region
0,"49 Oak St, Northampton, MA 01062",HAMPSHIRE01,56,1st Hampshire,Lindsay N.,Sabadosa,(D),Lindsay N. Sabadosa (D),https://malegislature.gov/Legislators/Profile/L_S1,True
1,"23 Bates Pond Rd, Carver, MA 02330",PLY02,112,2nd Plymouth,John R.,Gaskey,(R),John R. Gaskey (R),https://malegislature.gov/Legislators/Profile/JRG2,True
2,"29 Paulette Terrace, Plymouth, MA 02360",PLY01,111,1st Plymouth,Michelle L.,Badger,(D),Michelle L. Badger (D),https://malegislature.gov/Legislators/Profile/MLB1,True
3,"200 Packard Ave, Medford, MA 02155",MIDDLE34,92,34th Middlesex,Christine P.,Barber,(D),Christine P. Barber (D),https://malegislature.gov/Legislators/Profile/CPB2,True
4,"45 N Main St, Ipswich, MA 01938",ESSEX02,25,2nd Essex,Kristin E.,Kassner,(D),Kristin E. Kassner (D),https://malegislature.gov/Legislators/Profile/K_K2,True
